{
  "version": "20260916-1.0",
  "generated": "2026-09-16T14:04:24Z",
  "count": 234,
  "relationships": [
    {
      "id": "FB000001",
      "food": "FD001",
      "bioactive": "DF001",
      "strength": 5,
      "confidence": "High",
      "part": "Whole grain (bran/endosperm cell walls)",
      "preparation": [
        "Any"
      ],
      "bioavailability": "Low",
      "notes": "Soluble fibre acting locally in the gut; not systemically absorbed. EFSA-recognised cholesterol-lowering claim applies to oat and barley beta-glucan specifically."
    },
    {
      "id": "FB000002",
      "food": "FD001",
      "bioactive": "DF004",
      "strength": 3,
      "confidence": "Moderate",
      "part": "Whole food (starch fraction)",
      "preparation": [
        "Cooked"
      ],
      "bioavailability": "Low",
      "notes": "Resistant to digestion in the small intestine and fermented in the colon; content typically increases when starchy foods are cooked and then cooled."
    },
    {
      "id": "FB000003",
      "food": "FD001",
      "bioactive": "DF006",
      "strength": 3,
      "confidence": "Moderate",
      "part": "Cell walls (whole food)",
      "preparation": [
        "Any"
      ],
      "bioavailability": "Low",
      "notes": "Insoluble fibre; not absorbed, adds bulk and supports bowel regularity."
    },
    {
      "id": "FB000004",
      "food": "FD001",
      "bioactive": "PP012",
      "strength": 4,
      "confidence": "High",
      "part": "Bran layer",
      "preparation": [
        "Cooked"
      ],
      "bioavailability": "Moderate",
      "notes": "Oat-specific polyphenols with genuine, though modest, systemic absorption."
    },
    {
      "id": "FB000005",
      "food": "FD001",
      "bioactive": "DF005",
      "strength": 3,
      "confidence": "Moderate",
      "part": "Bran/outer layer",
      "preparation": [
        "Any"
      ],
      "bioavailability": "Low",
      "notes": "Insoluble/soluble fibre fraction acting locally in the gut."
    },
    {
      "id": "FB000006",
      "food": "FD001",
      "bioactive": "DF007",
      "strength": 3,
      "confidence": "Moderate",
      "part": "Cell walls (whole food)",
      "preparation": [
        "Any"
      ],
      "bioavailability": "Low",
      "notes": "Insoluble fibre fraction; acts locally in the gut."
    },
    {
      "id": "FB000007",
      "food": "FD001",
      "bioactive": "DF008",
      "strength": 3,
      "confidence": "Moderate",
      "part": "Seed coat/hull",
      "preparation": [
        "Any"
      ],
      "bioavailability": "Low",
      "notes": "Insoluble fibre component; not absorbed."
    },
    {
      "id": "FB000008",
      "food": "FD001",
      "bioactive": "PS002",
      "strength": 4,
      "confidence": "Moderate",
      "part": "Seed/nut oil fraction",
      "preparation": [
        "Any"
      ],
      "bioavailability": "Low",
      "notes": "Poorly absorbed; competes with dietary and biliary cholesterol for intestinal absorption."
    },
    {
      "id": "FB000009",
      "food": "FD001",
      "bioactive": "FC007",
      "strength": 3,
      "confidence": "Moderate",
      "part": "Whole food (trace amounts)",
      "preparation": [
        "Any"
      ],
      "bioavailability": "Low",
      "notes": "Present only in small, variable amounts in food; dietary contribution is modest compared with the body's own endogenous production."
    },
    {
      "id": "FB000010",
      "food": "FD002",
      "bioactive": "PP001",
      "strength": 5,
      "confidence": "High",
      "part": "Skin/peel and flesh",
      "preparation": [
        "Raw"
      ],
      "bioavailability": "Low",
      "notes": "Polyphenol with genuinely low systemic bioavailability (commonly cited under 5%); most benefit is thought to arise from gut-microbiome metabolites and local antioxidant effects."
    },
    {
      "id": "FB000011",
      "food": "FD002",
      "bioactive": "PP003",
      "strength": 3,
      "confidence": "Moderate",
      "part": "Whole food",
      "preparation": [
        "Raw"
      ],
      "bioavailability": "Moderate",
      "notes": "Absorption is moderate and influenced by co-consumed food matrix."
    },
    {
      "id": "FB000012",
      "food": "FD002",
      "bioactive": "PP008",
      "strength": 4,
      "confidence": "High",
      "part": "Skin and flesh",
      "preparation": [
        "Raw",
        "Cooked"
      ],
      "bioavailability": "Moderate",
      "notes": "Bioavailability is reduced by roasting at high temperature but the compound remains a major contributor to dietary polyphenol intake."
    },
    {
      "id": "FB000013",
      "food": "FD003",
      "bioactive": "PP001",
      "strength": 5,
      "confidence": "High",
      "part": "Skin/peel and flesh",
      "preparation": [
        "Raw"
      ],
      "bioavailability": "Low",
      "notes": "Polyphenol with genuinely low systemic bioavailability (commonly cited under 5%); most benefit is thought to arise from gut-microbiome metabolites and local antioxidant effects."
    },
    {
      "id": "FB000014",
      "food": "FD003",
      "bioactive": "PP007",
      "strength": 4,
      "confidence": "High",
      "part": "Skin/seeds",
      "preparation": [
        "Raw"
      ],
      "bioavailability": "Low",
      "notes": "Absorbed poorly as the free acid; most benefit is attributed to gut-microbiome-derived urolithin metabolites."
    },
    {
      "id": "FB000015",
      "food": "FD004",
      "bioactive": "CA004",
      "strength": 3,
      "confidence": "Moderate",
      "part": "Flesh/leaves",
      "preparation": [
        "Cooked"
      ],
      "bioavailability": "Variable",
      "notes": "Fat-soluble provitamin-A carotenoid; absorption is markedly improved by cooking and by co-ingested fat."
    },
    {
      "id": "FB000016",
      "food": "FD004",
      "bioactive": "PP001",
      "strength": 5,
      "confidence": "High",
      "part": "Skin/peel and flesh",
      "preparation": [
        "Raw"
      ],
      "bioavailability": "Low",
      "notes": "Polyphenol with genuinely low systemic bioavailability (commonly cited under 5%); most benefit is thought to arise from gut-microbiome metabolites and local antioxidant effects."
    },
    {
      "id": "FB000017",
      "food": "FD004",
      "bioactive": "PP009",
      "strength": 4,
      "confidence": "High",
      "part": "Peel and pith (concentrated), also in flesh/juice",
      "preparation": [
        "Raw"
      ],
      "bioavailability": "Moderate",
      "notes": "A citrus flavanone glycoside; absorption depends on hydrolysis by gut bacteria."
    },
    {
      "id": "FB000018",
      "food": "FD005",
      "bioactive": "DF004",
      "strength": 3,
      "confidence": "Moderate",
      "part": "Whole food (starch fraction)",
      "preparation": [
        "Cooked"
      ],
      "bioavailability": "Low",
      "notes": "Resistant to digestion in the small intestine and fermented in the colon; content typically increases when starchy foods are cooked and then cooled."
    },
    {
      "id": "FB000019",
      "food": "FD005",
      "bioactive": "PP001",
      "strength": 5,
      "confidence": "High",
      "part": "Skin/peel and flesh",
      "preparation": [
        "Raw"
      ],
      "bioavailability": "Low",
      "notes": "Polyphenol with genuinely low systemic bioavailability (commonly cited under 5%); most benefit is thought to arise from gut-microbiome metabolites and local antioxidant effects."
    },
    {
      "id": "FB000020",
      "food": "FD005",
      "bioactive": "PP007",
      "strength": 4,
      "confidence": "High",
      "part": "Skin/seeds",
      "preparation": [
        "Raw"
      ],
      "bioavailability": "Low",
      "notes": "Absorbed poorly as the free acid; most benefit is attributed to gut-microbiome-derived urolithin metabolites."
    },
    {
      "id": "FB000021",
      "food": "FD006",
      "bioactive": "CA002",
      "strength": 5,
      "confidence": "High",
      "part": "Leaves/flesh",
      "preparation": [
        "Cooked"
      ],
      "bioavailability": "Variable",
      "notes": "Fat-soluble; absorption is improved by cooking and by eating with a source of dietary fat."
    },
    {
      "id": "FB000022",
      "food": "FD006",
      "bioactive": "CA003",
      "strength": 4,
      "confidence": "High",
      "part": "Leaves/flesh",
      "preparation": [
        "Cooked"
      ],
      "bioavailability": "Variable",
      "notes": "Fat-soluble; absorption is improved by cooking and by eating with a source of dietary fat."
    },
    {
      "id": "FB000023",
      "food": "FD006",
      "bioactive": "DF007",
      "strength": 3,
      "confidence": "Moderate",
      "part": "Cell walls (whole food)",
      "preparation": [
        "Any"
      ],
      "bioavailability": "Low",
      "notes": "Insoluble fibre fraction; acts locally in the gut."
    },
    {
      "id": "FB000024",
      "food": "FD006",
      "bioactive": "PP005",
      "strength": 3,
      "confidence": "Moderate",
      "part": "Skin/outer leaves",
      "preparation": [
        "Raw"
      ],
      "bioavailability": "Moderate",
      "notes": "Flavonol with moderate, variable absorption depending on food matrix and gut microbiome."
    },
    {
      "id": "FB000025",
      "food": "FD007",
      "bioactive": "CA004",
      "strength": 4,
      "confidence": "High",
      "part": "Flesh/leaves",
      "preparation": [
        "Cooked"
      ],
      "bioavailability": "Variable",
      "notes": "Corrected from an earlier erroneous Lycopene mapping: kale's dominant carotenoids are beta-carotene and lutein, not lycopene, which is essentially a tomato/watermelon-family pigment."
    },
    {
      "id": "FB000026",
      "food": "FD007",
      "bioactive": "OS002",
      "strength": 5,
      "confidence": "High",
      "part": "Whole vegetable (formed enzymatically on damage)",
      "preparation": [